{
 "schema": "polyglot.lesson/v2",
 "track": "jev",
 "id": 2,
 "roadmap": "jev-05-openrouter-integration",
 "kind": "core",
 "title": "Jev via OpenRouter en Lokale Alternatieven",
 "subtitle": "Van OpenRouter API-integratie (typesafe/jev-1.13) tot zero-cost lokale classifiers met ModernBERT, SLM's en constrained decoding",
 "level": "praktijk",
 "minutes": 50,
 "summary": "Hoe roep je Jev aan in de praktijk, en wat doe je als je data vertrouwelijk is of als je nul API-kosten (API = application programming interface) wilt? In deze les leer je de OpenRouter API voor typesafe/jev-1.13 implementeren en ontdek je de krachtigste lokale alternatieven: ModernBERT voor 15ms inferentie op CPU (central processing unit) en compacte SLM's (small language model) met constrained decoding (Outlines/GBNF (GGML BNF) grammars).",
 "objectives": [
  {
   "id": "openrouter-api",
   "text": "De OpenRouter API voor Jev (typesafe/jev-1.13) aanroepen met de juiste headers, payload en getypeerde question definitions."
  },
  {
   "id": "why-local-privacy",
   "text": "De 4 doorslaggevende argumenten voor lokale modellen benoemen: privacy (GDPR), offline werking, netwerklatentie en nul API-kosten."
  },
  {
   "id": "modernbert-encoder",
   "text": "Begrijpen waarom encoder-only modellen (ModernBERT / DeBERTa) 100x sneller zijn voor beslissingen dan generatieve decoders."
  },
  {
   "id": "slm-constrained",
   "text": "Small Language Models (Qwen2.5-0.5B / Llama-3.2-1B) inzetten met constrained decoding (Outlines / GBNF grammars) voor 100% syntaxisgarantie."
  },
  {
   "id": "cost-latency-tradeoff",
   "text": "Een kwantitatieve trade-off matrix opstellen tussen Cloud Jev, lokale ModernBERT en Frontier LLM's (large language model)."
  }
 ],
 "sections": [
  {
   "id": "sec-01",
   "title": "1. Jev Aanspreken via de OpenRouter API",
   "md": "Om Jev in je eigen applicaties, Python-scripts of n8n-workflows te gebruiken, hoef je geen aparte SDK (software development kit) te installeren. TypeSafe stelt Jev rechtstreeks beschikbaar via de **OpenRouter** API onder model-identificatie `typesafe/jev-1.13` (of de dynamische alias `typesafe/jev-latest`).\n\nOmdat OpenRouter compatibel is met de OpenAI REST-standaard (REST = Representational State Transfer), stuur je een eenvoudige HTTP (Hypertext Transfer Protocol) `POST`-request naar `https://openrouter.ai/api/v1/chat/completions` met de standaard authenticatie-headers:\n\n```bash\ncurl https://openrouter.ai/api/v1/chat/completions \\\n  -H \"Authorization: Bearer $OPENROUTER_API_KEY\" \\\n  -H \"Content-Type: application/json\" \\\n  -d '{\n    \"model\": \"typesafe/jev-1.13\",\n    \"messages\": [\n      {\"role\": \"user\", \"content\": \"Klantmail: Mijn factuur klopt niet, er staat €49 te veel op.\"}\n    ],\n    \"decision\": {\n      \"type\": \"choice\",\n      \"question\": \"Naar welk team moet dit bericht gerouteerd worden?\",\n      \"options\": [\"Facturatie\", \"Technische Helpdesk\", \"Sales\", \"Overig\"]\n    }\n  }'\n```\n\nHet cruciale verschil met een generatieve LLM zit in het antwoord. Je krijgt **geen tekstuele markdown** terug die met regex gestript moet worden, maar direct een getypeerd payload-object met de gekalibreerde kansverdeling:\n\n```json\n{\n  \"decision\": {\n    \"type\": \"choice\",\n    \"winner\": \"Facturatie\",\n    \"probabilities\": {\n      \"Facturatie\": 0.942,\n      \"Technische Helpdesk\": 0.031,\n      \"Sales\": 0.012,\n      \"Overig\": 0.015\n    }\n  },\n  \"usage\": {\n    \"prompt_tokens\": 38,\n    \"completion_tokens\": 0,\n    \"total_cost\": 0.0000016\n  }\n}\n```\n\nMerk op: `completion_tokens` is exact **0**. Je betaalt uitsluitend voor de inkomende tokens ($0.042 per 1 miljoen tokens)."
  },
  {
   "id": "sec-02",
   "title": "2. Waarom Lokaal? De Vier Drijfveren",
   "md": "Hoewel Jev via OpenRouter extreem goedkoop en snel is, zijn er scenario's waarin cloud-API's niet wenselijk of zelfs strikt verboden zijn. Er zijn **vier doorslaggevende redenen** om te kiezen voor een lokaal beslissingsmodel:\n\n1. **Data Privacy en Compliance (GDPR / HIPAA (Health Insurance Portability and Accountability Act, de Amerikaanse zorgprivacywet)):** Financiële transacties, patiëntendossiers of interne bedrijfsgeheimen mogen in veel B2B-sectoren de lokale server of het datacenter contractueel niet verlaten. Met een lokaal model blijft 100% van de data op je eigen machine (zoals een lokale Mac mini, MacBook 2 of on-premise VPS (virtual private server)).\n2. **Netwerklatentie (Egress / Ingress):** Een cloud API call heeft altijd te maken met een round-trip time (RTT): DNS (Domain Name System) lookup, TLS (Transport Layer Security) handshake en netwerkafstand naar het datacenter. Zelfs als Jev in 70 ms rekent, kost de netwerkoverdracht vaak 100 ms tot 250 ms. Een lokaal model op een Apple Silicon M-chip reageert in **10 tot 25 ms**.\n3. **Nul Marginale Kosten ($0.00):** Als je honderdduizenden records per nacht batch-verwerkt (bijvoorbeeld voor data-cleaning of archivering), telt elke micro-cent. Een lokaal model draait op hardware die je al bezit, met nul variabele API-kosten.\n4. **Offline Beschikbaarheid:** Lokale scripts, command-line tools en embedded systemen functioneren foutloos zonder internetverbinding of wanneer externe API-gateways storingen ondervinden."
  },
  {
   "id": "sec-03",
   "title": "3. Het Wapen van de Architect: ModernBERT en Encoder-Only Modellen",
   "md": "Wanneer ingenieurs denken aan 'lokale AI', grijpen ze vaak automatisch naar een gekwantiseerd LLM (zoals Llama of Mistral). Dat is een fundamentele vergissing voor beslissingstaken!\n\nLLM's zijn **decoder-only** architecturen: ze gebruiken een causaal aandachtsmasker (causal attention mask) waardoor elk token alleen naar eerdere tokens kan kijken, en genereren daarna token per token. Voor classificatie en scoring is een **encoder-only** model ordes van grootte superieur:\n\n- **Bidirectionele Attention:** Een encoder ziet de volledige context in beide richtingen tegelijkertijd. Woord 5 kan direct interageren met woord 500.\n- **Één Enkele Forward Pass:** De invoer passeert eenmaal door de lagen; de classificatiekop (linear layer + softmax) berekent de logit-vector in één rekenstap.\n\nEind 2024 lanceerde Answer.AI in samenwerking met LightOn **ModernBERT**. ModernBERT moderniseert de klassieke BERT-architectuur (BERT = Bidirectional Encoder Representations from Transformers) met de nieuwste innovaties:\n- **Flash Attention & Rotary Position Embeddings (RoPE)**\n- Native contextvenster van **8.192 tokens** (in plaats van de verouderde 512 tokens van klassieke BERT)\n- Ongelofelijke snelheid: ModernBERT-base (149M parameters) verwerkt teksten in **15 tot 20 milliseconden** op een gewone laptop CPU of Mac M-chip!\n\nDoor een kleine classificatiekop te trainen of een zero-shot NLI-kop (Natural Language Inference) te gebruiken, functioneert ModernBERT als een volwaardige lokale Jev-vervanger met nul API-kosten."
  },
  {
   "id": "sec-04",
   "title": "4. Small Language Models (SLMs) en Constrained Decoding",
   "md": "Wat als je toch een generatief taalmodel wilt inzetten voor beslissingen (bijvoorbeeld omdat je flexibele redeneerstappen of meertalige semantiek nodig hebt)? Dan kies je voor een **Small Language Model (SLM)** gecombineerd met **constrained decoding**.\n\nModerne SLM's zoals **Qwen2.5-0.5B**, **Qwen2.5-1.5B** of **Llama-3.2-1B** zijn zo compact dat ze bij 4-bit kwantisatie (Q4_K_M) slechts 400 MB tot 900 MB RAM (random-access memory, het werkgeheugen) innemen. Ze draaien met 80 tot 150 tokens per seconde op een standaard Mac.\n\nOm te voorkomen dat een SLM syntaxfouten maakt, gebruiken we **constrained decoding** via frameworks zoals **Outlines**, **Guidance** of **GBNF grammars** in llama.cpp:\n\n```\n┌──────────────────────────────────────────────┐\n│ neuraal netwerk berekent logits (ongefilterd)│\n└──────────────────────┬───────────────────────┘\n                       ▼\n┌──────────────────────────────────────────────┐\n│ Logit Masking: tokens buiten BNF-grammatica  │\n│ krijgen logit = -infinity                    │\n└──────────────────────┬───────────────────────┘\n                       ▼\n┌──────────────────────────────────────────────┐\n│ Softmax kiest 100% gegarandeerd geldig token │\n└──────────────────────────────────────────────┘\n```\n\nDoor logits van ongeldige tokens op $-\\infty$ te zetten, is het wiskundig **onmogelijk** dat het model iets anders genereert dan het opgegeven schema. Geen retries, geen regex-fouten!"
  },
  {
   "id": "sec-05",
   "title": "5. De Kwantitatieve Vergelijkingstabel",